{
  "host": "claude-code",
  "bundle_root": ".",
  "description": "Claude Code installs a marketplace directory source directly, so this host's bundle is the plugin itself with the development surface removed. bundle_root is '.' because marketplace.json declares source './'; a host that nests its plugin inside the bundle sets this to that subdirectory. roles/ and hosts/ are NOT development surface, although they look like it: the bundle ships validate_roles.py, render_agents.py and root_preflight.py, and all three read those manifests - along with adapters/<host>/agent-interface.json, which is what decides whether a delegating role may be built here at all. Only THIS host's manifest and interface ship: the others name bundled_dir paths that a Claude Code install has no reason to carry, and the capability gate would then report every one of them as ungenerated. Without them the capability gate the README tells root to run before dispatching reports that no role fills any position, and root's startup check cannot derive what it is checking against - a gate that cannot run in the product is worse than none, because the protocol still says it ran.",
  "place": {
    ".claude-plugin/": ".claude-plugin/",
    "agents/": "agents/",
    "adapters/claude-code/": "adapters/claude-code/",
    "hosts/claude-code.json": "hosts/claude-code.json",
    "roles/": "roles/",
    "hooks/": "hooks/",
    "references/": "references/",
    "schemas/": "schemas/",
    "scripts/": "scripts/",
    "SKILL.md": "SKILL.md"
  },
  "exclude": [
    "**/__pycache__/**",
    "**/*.pyc"
  ]
}
